<?xml version="1.0" encoding="UTF-8"?>
<!DOCTYPE dml PUBLIC "-//OPENEMULATOR//DTD DML 1.0//EN" "http://www.openemulator.org/DTDs/dml-1.0.dtd">
<dml version="1.0">
<device class="Host" type="host" platform="" group="">
    <components>
    <component class="AudioController" />
    <component class="DiskController" />
    <component class="EthernetController" />
    <component class="EventController" />
    <component class="JoystickController" />
    <component class="KeyboardController" />
    <component class="MouseController" />
    <component class="ResourceController" />
    <component class="SerialController" />
    <component class="TabletController" />
    <component class="VideoController" />
    <component class="WavePlayer" />
    </components>
</device>
</dml>
