<?xml version="1.0" encoding="UTF-8"?>
<!DOCTYPE dml PUBLIC "-//OPENEMULATOR//DTD DML 1.0//EN" "http://www.openemulator.org/DTDs/dml-1.0.dtd">
<dml version="1.0" label="IBM PC 5150" image="IBM PC 5150.png" description="" group="PC">
<device name="host">
    <component name="events" class="EventController">
        <property name="runTime" value="0.0" />
    </component>
    <component name="audio" class="AudioController">
        <property name="volume" value="1.0" />
    </component>
    <component name="video" class="VideoController">
    </component>
    <component name="keyboard" class="KeyboardController">
    </component>
    <component name="joystick" class="JoystickController">
    </component>
    <component name="mouse" class="MouseController">
    </component>
    <component name="tablet" class="TabletController">
    </component>
</device>

<device name="dev0" label="IBM PC">
</device>

</dml>
