<?xml version="1.0" encoding="UTF-8"?>
<!DOCTYPE dml PUBLIC "-//OPENEMULATOR//DTD DML 1.0//EN" "http://www.openemulator.org/DTDs/dml-1.0.dtd">
<dml version="1.0">
<device class="Apple I" type="core" platform="Apple I" group="Apple I" description="The Apple I was Apple's first product. It was a fully assembled circuit board containing about 30 chips, but users still had to add a case, power supply, keyboard, and display. One major difference sets the Apple I apart â€” it was the first personal computer to use a keyboard." image="$RESOURCES/Apple I.png">
    <components>
    <component class="AppleIFloatingBus" />
    <component class="AppleIEventController">
        <property name="eventController" value="Host::EventController" />
    </component>
    <component class="MOS6502">
        <property name="mmu" value="AppleIMMU" />
    </component>
    <component class="AppleIMMU" />
    <component class="AppleIMemory">
        <property name="mmu" value="AppleIMMU" />
        <property name="memoryImage" value="$PROFILE/Apple I RAM.bin" />
        <property name="resourceController" value="Host::ResourceController" />
    </component>
    <component class="AppleIROM">
        <property name="mmu" value="AppleIMMU" />
        <property name="memoryImage" value="$RESOURCES/Apple I ROM.bin" />
        <property name="resourceController" value="Host::ResourceController" />
    </component>
    <component class="AppleISlotController">
        <port type="Apple I Slot" name="slotR" label="Slot R" />
        <port type="Apple I Slot" name="slotS" label="Slot S" />
        <port type="Apple I Slot" name="slotT" label="Slot T" />
    </component>
    <component class="AppleIVIA">
        <property name="mmu" value="AppleIMMU" />
        <property name="keyboardController" value="Host::KeyboardController" />
    </component>
    <component class="AppleIVideoController">
        <property name="videoController" value="Host::VideoController" />
        <property name="characterSet" value="/Resources/Apple II Video ROM.bin" />
    </component>
    </components>
</device>
</dml>
